{
  "schema_version": "0.1",
  "matter_id": "DEMO-MATTER",
  "source_locators": [
    {
      "schema_version": "0.2",
      "locator_id": "LOC-001",
      "source_id": "SRC-001",
      "source_type": "matter_file",
      "file_or_resource": "示例合同.pdf",
      "locator_type": "page",
      "locator_value": "第3页第2段",
      "verification_state": "VERIFIED"
    },
    {
      "schema_version": "0.2",
      "locator_id": "LOC-002",
      "source_id": "SRC-002",
      "source_type": "official_law",
      "file_or_resource": "示例法律官方文本",
      "locator_type": "url_section",
      "locator_value": "第X条第Y款",
      "verification_state": "VERIFIED"
    }
  ],
  "sources": [
    {
      "schema_version": "0.2",
      "source_id": "SRC-001",
      "source_family": "MATTER_EVIDENCE",
      "source_type": "contract",
      "title": "示例合同",
      "verification_state": "VERIFIED",
      "stance": "NEUTRAL",
      "locators": [
        "LOC-001"
      ]
    },
    {
      "schema_version": "0.2",
      "source_id": "SRC-002",
      "source_family": "LEGAL_AUTHORITY",
      "source_type": "statute",
      "title": "示例法律（仅示意结构）",
      "verification_state": "VERIFIED",
      "stance": "NEUTRAL",
      "locators": [
        "LOC-002"
      ]
    }
  ],
  "facts": [
    {
      "schema_version": "0.2",
      "fact_id": "F-001",
      "matter_id": "DEMO-MATTER",
      "statement": "示例事实命题",
      "fact_status": "VERIFIED",
      "source_refs": [
        "SRC-001"
      ],
      "supporting_evidence_ids": [
        "E-001"
      ]
    }
  ],
  "evidence_items": [
    {
      "schema_version": "0.2",
      "evidence_id": "E-001",
      "matter_id": "DEMO-MATTER",
      "name": "示例合同条款",
      "evidence_type": "document",
      "source_ref": "SRC-001",
      "source_locator_refs": [
        "LOC-001"
      ],
      "supports_fact_ids": [
        "F-001"
      ],
      "review_state": "REVIEWED"
    }
  ],
  "issues": [
    {
      "schema_version": "0.2",
      "issue_id": "I-001",
      "matter_id": "DEMO-MATTER",
      "question": "示例法律问题",
      "issue_type": "LEGAL",
      "status": "PROVISIONALLY_RESOLVED",
      "dependent_fact_ids": [
        "F-001"
      ]
    }
  ],
  "legal_rules": [
    {
      "schema_version": "0.2",
      "rule_id": "R-001",
      "rule_type": "LEGAL",
      "rule_level": "L0",
      "jurisdiction": "示例法域",
      "rule_statement": "示例规则命题，仅用于展示溯源结构",
      "source_refs": [
        "SRC-002"
      ],
      "pinpoint_refs": [
        "LOC-002"
      ],
      "verification_state": "VERIFIED_CURRENT",
      "last_verified_at": "2026-08-15"
    }
  ],
  "case_cards": [],
  "arguments": [
    {
      "schema_version": "0.2",
      "argument_id": "A-001",
      "matter_id": "DEMO-MATTER",
      "issue_id": "I-001",
      "argument_scope": "MATTER_SPECIFIC",
      "proposition": "示例论证命题",
      "rule_refs": [
        "R-001"
      ],
      "supporting_fact_ids": [
        "F-001"
      ],
      "supporting_evidence_ids": [
        "E-001"
      ],
      "reasoning_methods": [
        "SUBSUMPTION"
      ],
      "reasoning_summary": "将示例规则与示例事实逐项对应。",
      "conclusion": "示例结论",
      "status": "SUPPORTED"
    }
  ],
  "findings": [
    {
      "schema_version": "0.2",
      "finding_id": "FD-001",
      "matter_id": "DEMO-MATTER",
      "issue_id": "I-001",
      "statement": "示例分析发现",
      "finding_type": "LEGAL_ANALYSIS",
      "status": "SUPPORTED",
      "owner_skill": "合同与交易工作",
      "argument_ids": [
        "A-001"
      ],
      "supporting_fact_ids": [
        "F-001"
      ],
      "supporting_rule_ids": [
        "R-001"
      ],
      "supporting_evidence_ids": [
        "E-001"
      ],
      "importance": "HIGH",
      "traceability_state": "FULL"
    }
  ],
  "deliverable_claims": [
    {
      "schema_version": "0.1",
      "claim_id": "DC-001",
      "matter_id": "DEMO-MATTER",
      "artifact_id": "DEMO-REPORT",
      "artifact_locator": "第2部分第1段",
      "statement": "示例正式交付命题",
      "claim_type": "LEGAL_ANALYSIS",
      "importance": "HIGH",
      "finding_ids": [
        "FD-001"
      ],
      "argument_ids": [
        "A-001"
      ],
      "traceability_state": "FULL"
    }
  ],
  "links": []
}
